{
  "task_id": "code3d-fps-001",
  "category": "code-to-3d",
  "mission": "fps",
  "axes": [
    "adherence",
    "fidelity",
    "consistency",
    "controllability",
    "efficiency"
  ],
  "difficulty": "L4",
  "input": {
    "prompt": "做一个基于three.js的fps游戏",
    "assets": []
  },
  "fixed_params": {},
  "samples": 3,
  "rubric": [
    {
      "key": "A",
      "weight": 0.2
    },
    {
      "key": "B",
      "weight": 0.25
    },
    {
      "key": "C",
      "weight": 0.15
    },
    {
      "key": "D",
      "weight": 0.15
    },
    {
      "key": "E",
      "weight": 0.1
    },
    {
      "key": "F",
      "weight": 0.1
    },
    {
      "key": "G",
      "weight": 0.05
    }
  ],
  "version": 1,
  "status": "draft",
  "pending": [
    "冻结确切参数、浏览器环境与评判脚本",
    "补充 A 模式三次采样记录"
  ],
  "source_doc": "benchmark/tasks/code-to-3d/fps.md",
  "rubric_profile": "shared/rubrics/code-to-3d.md"
}
