{
  "task_id": "code3d-manhattan-001",
  "category": "code-to-3d",
  "mission": "manhattan",
  "axes": [
    "adherence",
    "fidelity",
    "consistency",
    "controllability",
    "efficiency"
  ],
  "difficulty": "L3",
  "input": {
    "prompt": "用 Web 3D 技术(Three.js 等通用库允许,游戏引擎导出物禁止)复现一片可辨认的 3D 曼哈顿。要求:\n\n1. **建模**:曼哈顿式路网(南北大道 × 东西街道 + 百老汇斜切产生三角地块),≥4 座可辨认地标(如帝国大厦、克莱斯勒大厦、世贸中心一号楼、熨斗大厦),成片程序化楼群与屋顶水塔、路灯、红绿灯等城市肌理,一座悬索桥。\n2. **3D 雕刻**:中央公园起伏地形与下凹水塘、裸露岩石、一座自由女神像(衣褶需体现雕刻手法)、有体积感的云团——全部用顶点级雕刻/位移完成,禁止用贴图假装体积。\n3. **动画**:完整昼夜循环(太阳/月亮/星空/窗灯/路灯联动);车辆沿路网行驶、路口红绿灯停走与转向;≥2 种非车辆动画体(鸟群/直升机/船只等);广告牌、井盖蒸汽等环境动画;相机支持自由轨道 + 自动环游。\n4. **天气**:≥5 种可切换天气(至少含雨、雪、雾、雷暴),切换需平滑过渡;场景必须响应——雨天路面变湿、雪天屋顶与地面积雪、雾天高楼没顶、雷暴闪电击中高楼并伴随雷声;风影响雨雪倾角与云速。\n5. **计算**:种子驱动的确定性城市生成(同种子同城市,可输入种子重建);≥2 处真实公式(如纬度 40.7°N 的太阳高度角、悬索桥主缆悬链线、双峰天际线高度场);带信号相位与跟车防撞的交通仿真;实例化渲染,桌面 1080p ≥60fps,运行时统计 HUD(FPS/drawcall/实例数)。\n\n约束:禁止加载任何外部二进制资产(模型/贴图/音频文件),所有几何、纹理、音效必须程序化生成;UI 用中文;无控制台报错。\n**公平对比原则**:直接横向对比只在**同一 variant 内**进行。跨 variant 只比\"公共核心要求\"部分。",
    "assets": []
  },
  "fixed_params": {
    "resolution": "1920x1080",
    "observe": "≥90s,覆盖完整昼夜 + 全部天气各≥10s",
    "seeds": [
      1337,
      2026,
      42
    ],
    "env": "桌面 Chrome 最新稳定版,固定 GPU 档"
  },
  "samples": 3,
  "rubric": [
    {
      "key": "A-需求遵循(五能力清单)",
      "weight": 0.2,
      "anchor": "0 五组缺≥2组 · 3 五组齐但条目有缺 · 5 逐条全满足"
    },
    {
      "key": "B-视觉审美",
      "weight": 0.25,
      "anchor": "0 不可辨认 · 3 像素材拼盘但可信 · 5 氛围/构图/配色出色"
    },
    {
      "key": "C-技术正确",
      "weight": 0.15,
      "anchor": "0 报错穿模 · 3 偶发瑕疵 · 5 无报错无闪烁物理合理"
    },
    {
      "key": "D-性能效率",
      "weight": 0.15,
      "anchor": "0 <20fps · 3 ≥45fps · 5 ≥60fps 且 drawcall 克制"
    },
    {
      "key": "E-一致稳定",
      "weight": 0.1,
      "anchor": "0 换分辨率即崩 · 3 长跑稳定 · 5 多分辨率+长跑+种子确定性全稳"
    },
    {
      "key": "F-可控交互",
      "weight": 0.1,
      "anchor": "0 无交互 · 3 面板可用 · 5 时间/天气/种子/相机全可控"
    },
    {
      "key": "G-代码质量",
      "weight": 0.05,
      "anchor": "0 一坨 · 3 有模块 · 5 模块清晰可维护+有测试"
    }
  ],
  "version": 1,
  "status": "draft",
  "pending": [
    "核对该题面是否与各模型实际收到的 prompt 一致",
    "冻结确切参数、环境与评判脚本"
  ],
  "source_doc": "benchmark/tasks/code-to-3d/manhattan.md",
  "rubric_profile": "shared/rubrics/code-to-3d.md"
}
